{
  "name": "agent-marketplace",
  "metadata": {
    "description": "A curated collection of Claude Code plugins by Joe Black",
    "version": "1.0.0",
    "homepage": "https://joeblackwaslike.github.io/agent-marketplace"
  },
  "owner": {
    "name": "Joe Black",
    "github": "joeblackwaslike"
  },
  "plugins": [
    {
      "name": "lessons-learned",
      "description": "Automatic mistake capture and proactive lesson injection for AI coding agents. Mines conversation logs for mistake patterns, structures them as indexed lessons, and injects relevant warnings before the agent repeats the mistake.",
      "source": {
        "source": "url",
        "url": "https://github.com/joeblackwaslike/lessons-learned.git"
      },
      "category": "productivity",
      "keywords": [
        "lessons",
        "mistakes",
        "hooks",
        "memory",
        "injection"
      ]
    },
    {
      "name": "mcp-exec",
      "description": "Reference implementation of Anthropic's Code execution with MCP — reuses Claude Code's own sandbox to keep intermediate tool output out of the context window on every workflow. Up to 99% fewer tokens.",
      "source": {
        "source": "url",
        "url": "https://github.com/joeblackwaslike/mcp-exec.git"
      },
      "category": "execution",
      "keywords": [
        "mcp",
        "sandbox",
        "execution",
        "tools"
      ]
    },
    {
      "name": "gstack",
      "description": "Garry Tan's gstack AI workflow skills, packaged as a Claude Code plugin with gstack: namespace. 47 skills including ship, review, qa, browse, investigate, office-hours, and more. Fork of garrytan/gstack.",
      "source": {
        "source": "url",
        "url": "https://github.com/joeblackwaslike/gstack.git"
      },
      "category": "productivity",
      "keywords": [
        "gstack",
        "workflow",
        "skills",
        "ship",
        "review",
        "qa",
        "browse",
        "garrytan"
      ]
    },
    {
      "name": "agent-skills",
      "description": "Joe Black's custom skills for Claude Code — agentic development, multi-provider plugin architecture, Claude Code plugin development, and best practices for working with Claude Code.",
      "source": {
        "source": "github",
        "repo": "joeblackwaslike/agent-skills"
      },
      "category": "productivity",
      "keywords": [
        "skills",
        "agent-development",
        "plugin-development",
        "agentic",
        "multi-provider",
        "claude-code"
      ]
    },
    {
      "name": "anti-compact",
      "description": "Intercepts /compact and generates a structured session handoff instead of lossy compaction. Preserves critical decision context that would otherwise be lost during Claude Code's automatic context compaction.",
      "source": {
        "source": "url",
        "url": "https://github.com/joeblackwaslike/anti-compact.git"
      },
      "category": "productivity",
      "keywords": [
        "context",
        "handoff",
        "compaction",
        "memory",
        "session",
        "hooks"
      ]
    },
    {
      "name": "ctx-tree",
      "description": "Persistent context graph for codebase and web navigation. Symbol-chunks files, stores nodes in a SQLite graph, and returns compact references — enabling recall across sessions without re-reading files.",
      "source": {
        "source": "github",
        "repo": "joeblackwaslike/ctx-tree"
      },
      "category": "memory",
      "keywords": [
        "memory",
        "context",
        "mcp",
        "recall",
        "sqlite",
        "embeddings",
        "knowledge-graph",
        "agent-memory"
      ]
    },
    {
      "name": "ai-review-bot",
      "description": "Autonomous multi-agent PR reviewer — coordinates with other AI review bots to avoid duplication, runs 5+ specialized sub-agents, and self-improves through the full review → re-review → approve loop.",
      "source": {
        "source": "github",
        "repo": "joeblackwaslike/ai-review-bot"
      },
      "category": "productivity",
      "keywords": [
        "github",
        "pr-review",
        "ai",
        "bot",
        "github-app",
        "code-review"
      ]
    },
    {
      "name": "spinup-py",
      "description": "Scaffold and maintain production-ready Python projects — uv for dependency management, ruff + mypy for quality, pytest + tox-uv for testing, GitHub Actions CI, and Docusaurus docs. The cookiecutter for modern Python.",
      "source": {
        "source": "github",
        "repo": "joeblackwaslike/spinup-py"
      },
      "category": "productivity",
      "keywords": [
        "python",
        "scaffold",
        "cli",
        "template",
        "uv",
        "ruff",
        "pytest",
        "cookiecutter"
      ]
    },
    {
      "name": "spinup-ts",
      "description": "Scaffold and maintain production-ready TypeScript projects — the cookiecutter-uv equivalent for the TypeScript ecosystem. Includes /new and /update commands plus a skill covering interactive and agent-driven scaffold flows.",
      "source": {
        "source": "github",
        "repo": "joeblackwaslike/spinup-ts"
      },
      "category": "productivity",
      "keywords": [
        "typescript",
        "scaffold",
        "cli",
        "template",
        "biome",
        "eslint",
        "vitest",
        "docusaurus"
      ]
    },
    {
      "name": "cc-recall",
      "description": "Make every Claude Code session discoverable by what was done, asked, and questioned. Indexes transcripts into a sidecar SQLite store with heuristic and LLM-powered synthesis. Includes SessionEnd hook for forward capture and UserPromptSubmit hook for search reminders.",
      "source": {
        "source": "github",
        "repo": "joeblackwaslike/cc-recall"
      },
      "category": "memory",
      "keywords": [
        "recall",
        "sessions",
        "transcripts",
        "search",
        "memory",
        "indexing",
        "discoverability",
        "hooks"
      ]
    }
  ]
}
