{
  "name": "agent-marketplace",
  "metadata": {
    "description": "A curated collection of Codex CLI plugins by Joe Black",
    "version": "1.0.0",
    "homepage": "https://joeblackwaslike.github.io/agent-marketplace"
  },
  "owner": {
    "name": "Joe Black",
    "github": "joeblackwaslike"
  },
  "plugins": [
    {
      "name": "mcp-exec",
      "description": "Reference implementation of Anthropic's Code execution with MCP — reuses Claude Code's own sandbox to keep intermediate tool output out of the context window on every workflow. Up to 99% fewer tokens.",
      "source": {
        "source": "url",
        "url": "https://github.com/joeblackwaslike/mcp-exec.git"
      },
      "category": "execution",
      "keywords": [
        "mcp",
        "sandbox",
        "execution",
        "tools"
      ]
    },
    {
      "name": "agent-skills",
      "description": "Joe Black's custom skills for Codex CLI — agentic development, multi-provider plugin architecture, plugin development best practices, and working with AI coding agents.",
      "source": {
        "source": "github",
        "repo": "joeblackwaslike/agent-skills"
      },
      "category": "productivity",
      "keywords": [
        "skills",
        "agent-development",
        "plugin-development",
        "agentic",
        "multi-provider",
        "codex"
      ]
    },
    {
      "name": "ctx-tree",
      "description": "Persistent context graph for codebase and web navigation. Symbol-chunks files, stores nodes in a SQLite graph, and returns compact references — enabling recall across sessions without re-reading files.",
      "source": {
        "source": "github",
        "repo": "joeblackwaslike/ctx-tree"
      },
      "category": "memory",
      "keywords": [
        "memory",
        "context",
        "mcp",
        "recall",
        "sqlite",
        "embeddings",
        "knowledge-graph",
        "agent-memory"
      ]
    },
    {
      "name": "spinup-py",
      "description": "Scaffold and maintain production-ready Python projects — uv for dependency management, ruff + mypy for quality, pytest + tox-uv for testing, GitHub Actions CI, and Docusaurus docs. The cookiecutter for modern Python.",
      "source": {
        "source": "github",
        "repo": "joeblackwaslike/spinup-py"
      },
      "category": "productivity",
      "keywords": [
        "python",
        "scaffold",
        "cli",
        "template",
        "uv",
        "ruff",
        "pytest",
        "cookiecutter"
      ]
    },
    {
      "name": "spinup-ts",
      "description": "Scaffold and maintain production-ready TypeScript projects — the cookiecutter-uv equivalent for the TypeScript ecosystem. Includes /new and /update commands plus a skill covering interactive and agent-driven scaffold flows.",
      "source": {
        "source": "github",
        "repo": "joeblackwaslike/spinup-ts"
      },
      "category": "productivity",
      "keywords": [
        "typescript",
        "scaffold",
        "cli",
        "template",
        "biome",
        "eslint",
        "vitest",
        "docusaurus"
      ]
    }
  ]
}
